{
  "$schema": "https://json-schema.org/draft/2020-12/schema",
  "$id": "healthcode-connect/medical-invoice",
  "title": "MedicalInvoice",
  "description": "Standard UK private medical invoice record. Field set follows Healthcode ePractice/VEDA electronic billing requirements (healthcode.co.uk/help-and-support/epractice-getting-started/), HMRC invoice requirements (gov.uk/invoicing-and-taking-payment-from-customers), and the VAT medical exemption (VAT Notice 701/57). Lexical patterns here catch shape only; checksums, dictionary membership, and cross-field rules run in backend/validation/rules/.",
  "type": "object",
  "required": ["invoice_number", "invoice_date", "practice", "patient", "policy", "provider", "episode", "lines", "totals", "currency"],
  "additionalProperties": false,
  "properties": {
    "invoice_number": {
      "type": "string",
      "pattern": "^[A-Za-z0-9/-]{1,30}$",
      "description": "Unique sequential identifier. HMRC: every invoice must carry a unique identification number; VATREC5010."
    },
    "invoice_date": { "$ref": "#/$defs/isoDate", "description": "Date of issue. HMRC required." },
    "currency": { "const": "GBP" },
    "practice": {
      "type": "object",
      "description": "Supplier identity. HMRC: business name, address and contact information.",
      "required": ["name", "address_line1", "postcode"],
      "additionalProperties": true,
      "properties": {
        "name": { "type": "string", "minLength": 1 },
        "address_line1": { "type": "string", "minLength": 1 },
        "postcode": { "type": "string", "minLength": 5 }
      }
    },
    "patient": {
      "type": "object",
      "description": "Patient identity. Healthcode: name, DOB, sex, address and postcode drive the insurer demographic match; mismatches are a top rejection cause.",
      "required": ["first_name", "surname", "date_of_birth", "sex", "address_line1", "postcode"],
      "additionalProperties": true,
      "properties": {
        "title": { "type": "string" },
        "first_name": { "type": "string", "minLength": 1 },
        "surname": { "type": "string", "minLength": 1 },
        "date_of_birth": { "$ref": "#/$defs/isoDate" },
        "sex": { "enum": ["M", "F", "X"] },
        "address_line1": { "type": "string", "minLength": 1 },
        "postcode": { "type": "string", "minLength": 5 },
        "nhs_number": {
          "type": ["string", "null"],
          "description": "Optional. 10 digits, Modulus-11 check digit per NHS Data Dictionary; verified arithmetically in rules/formats.py."
        }
      }
    },
    "policy": {
      "type": "object",
      "required": ["insurer_id", "membership_number"],
      "additionalProperties": true,
      "properties": {
        "insurer_id": { "type": "string", "minLength": 1, "description": "Key into dictionaries/insurers.json; selects the validation ruleset." },
        "membership_number": {
          "type": "string",
          "minLength": 1,
          "description": "Mandatory. Format enforced per insurer where published (Healthcode validation rules); Bupa/AXA/Aviva/Vitality formats are unpublished and validated by demographic match instead."
        },
        "pre_authorisation": {
          "type": ["string", "null"],
          "description": "Optional, but if present must match the insurer's format (VEDA: 'Authorisation Code - Must be in the format [...]')."
        }
      }
    },
    "provider": {
      "type": "object",
      "required": ["specialist_name", "gmc_number", "payee_provider_id", "treatment_site_id"],
      "additionalProperties": true,
      "properties": {
        "specialist_name": { "type": "string", "minLength": 1 },
        "gmc_number": { "type": "string", "description": "GMC reference number: 7 digits (NHS Data Dictionary attribute)." },
        "payee_provider_id": { "type": "string", "minLength": 1, "description": "Who gets paid; must be a recognised payee mapped to the insurer (VEDA: 'Payee Provider - Invalid Code')." },
        "treatment_site_id": { "type": "string", "minLength": 1, "description": "Facility; must be mapped to the insurer (VEDA: 'Hospital Number - Not Mapped')." }
      }
    },
    "episode": {
      "type": "object",
      "required": ["care_setting", "treatment_date", "diagnoses", "procedures"],
      "additionalProperties": true,
      "properties": {
        "care_setting": { "enum": ["outpatient", "day_case", "inpatient"], "description": "Must be clinically consistent with the procedures billed (VEDA setting rule)." },
        "treatment_date": { "$ref": "#/$defs/isoDate" },
        "admission_date": { "oneOf": [{ "$ref": "#/$defs/isoDate" }, { "type": "null" }] },
        "discharge_date": { "oneOf": [{ "$ref": "#/$defs/isoDate" }, { "type": "null" }] },
        "diagnoses": {
          "type": "array",
          "items": { "type": "string" },
          "description": "ICD-10 codes. Required content for insurers flagged requires_icd10 (Bupa, AXA Health, Vitality); enforced in rules/cross_field.py."
        },
        "procedures": {
          "type": "array",
          "items": { "type": "string" },
          "description": "CCSD schedule codes (the field Healthcode UIs label 'OPCS Code'). Format and schedule membership checked in rules/."
        }
      }
    },
    "lines": {
      "type": "array",
      "minItems": 1,
      "description": "HMRC: clear description of what is charged, with amounts.",
      "items": {
        "type": "object",
        "required": ["service_code", "description", "quantity", "unit_fee"],
        "additionalProperties": true,
        "properties": {
          "service_code": { "type": "string", "minLength": 1, "description": "Key into dictionaries/charge_codes.json (Industry Standard Code mapping)." },
          "description": { "type": "string", "minLength": 1 },
          "quantity": { "type": "integer", "minimum": 1 },
          "unit_fee": { "type": "number", "minimum": 0 },
          "vat_rate": { "type": "number", "minimum": 0, "maximum": 1, "description": "Medical services are VAT-exempt (Notice 701/57); a non-zero rate on an exempt service is flagged." }
        }
      }
    },
    "totals": {
      "type": "object",
      "required": ["net", "vat", "gross"],
      "additionalProperties": false,
      "properties": {
        "net": { "type": "number", "minimum": 0 },
        "vat": { "type": "number", "minimum": 0 },
        "gross": { "type": "number", "minimum": 0 }
      }
    }
  },
  "$defs": {
    "isoDate": { "type": "string", "pattern": "^\\d{4}-\\d{2}-\\d{2}$" }
  }
}
